{
  "schema_version": "0.1.0",
  "report_id": "harmonized-requirements-candidate-maturity",
  "status": "candidate",
  "normative": false,
  "enforcement": "none",
  "source_document_id": "CISO-REQ-SRC-001",
  "summary": {
    "harmonized_requirements": 44,
    "minimum_level_counts": {
      "L1": 22,
      "L2": 17,
      "L3": 1,
      "GOV": 4
    },
    "cumulative_level_counts": {
      "L1": 22,
      "L2": 39,
      "L3": 40,
      "GOV": 4
    },
    "routing_lane_counts": {
      "architecture": 5,
      "devsecops_baseline": 15,
      "evidence": 3,
      "governance": 4,
      "operations": 4,
      "platform": 2,
      "product_security": 11
    },
    "human_review_required": 44
  },
  "level_definitions": {
    "L1": {
      "name": "Foundational",
      "intent": "Establish repeatable minimum security practices and evidence for all applicable software."
    },
    "L2": {
      "name": "Managed",
      "intent": "Add centrally managed capabilities, standardized verification, monitoring, and enforceable gates."
    },
    "L3": {
      "name": "High Assurance",
      "intent": "Add isolation, provenance, continuous verification, and machine-readable high-assurance evidence."
    },
    "GOV": {
      "name": "Governance Overlay",
      "intent": "Govern applicability, accountability, review, deviations, and lifecycle decisions across all maturity levels."
    }
  },
  "maturity_by_requirement": [
    {
      "requirement_id": "HREQ-GOV-001",
      "title": "Secure development lifecycle",
      "domain": "governance",
      "applicability": "all_software",
      "minimum_level": "GOV",
      "maturity_path": [
        "GOV"
      ],
      "governance_overlay": true,
      "routing_lane": "governance",
      "assignment_basis": "governance_scope",
      "current_coverage": "partial",
      "existing_refs": [
        "DEVSECOPS-POL-SRC-001-REQ-020"
      ],
      "rationale": "Lifecycle governance sets the operating boundary for every adopted maturity level.",
      "review_status": "human_review_required"
    },
    {
      "requirement_id": "HREQ-GOV-002",
      "title": "Risk-based applicability",
      "domain": "governance",
      "applicability": "all_software",
      "minimum_level": "GOV",
      "maturity_path": [
        "GOV"
      ],
      "governance_overlay": true,
      "routing_lane": "governance",
      "assignment_basis": "governance_scope",
      "current_coverage": "partial",
      "existing_refs": [
        "DEVSECOPS-POL-SRC-001-REQ-017"
      ],
      "rationale": "Applicability determines which product, risk, and maturity obligations apply.",
      "review_status": "human_review_required"
    },
    {
      "requirement_id": "HREQ-GOV-003",
      "title": "Roles and competence",
      "domain": "governance",
      "applicability": "all_software",
      "minimum_level": "GOV",
      "maturity_path": [
        "GOV"
      ],
      "governance_overlay": true,
      "routing_lane": "governance",
      "assignment_basis": "governance_scope",
      "current_coverage": "partial",
      "existing_refs": [
        "DEVSECOPS-POL-SRC-001-REQ-014"
      ],
      "rationale": "Roles, competence, and reviewer independence are cross-level governance duties.",
      "review_status": "human_review_required"
    },
    {
      "requirement_id": "HREQ-GOV-004",
      "title": "Controlled security documentation",
      "domain": "governance",
      "applicability": "all_software",
      "minimum_level": "GOV",
      "maturity_path": [
        "GOV"
      ],
      "governance_overlay": true,
      "routing_lane": "governance",
      "assignment_basis": "governance_scope",
      "current_coverage": "partial",
      "existing_refs": [
        "DSCB-L1-REQ-001",
        "P1"
      ],
      "rationale": "Controlled documentation and evidence governance support all maturity levels.",
      "review_status": "human_review_required"
    },
    {
      "requirement_id": "HREQ-RISK-001",
      "title": "Asset and threat identification",
      "domain": "security_risk",
      "applicability": "risk_based",
      "minimum_level": "L1",
      "maturity_path": [
        "L1",
        "L2",
        "L3"
      ],
      "governance_overlay": false,
      "routing_lane": "architecture",
      "assignment_basis": "risk_and_capability",
      "current_coverage": "partial",
      "existing_refs": [
        "S5",
        "P8",
        "E6"
      ],
      "rationale": "Basic asset and threat identification is foundational when the risk-based applicability rule is triggered.",
      "review_status": "human_review_required"
    },
    {
      "requirement_id": "HREQ-RISK-002",
      "title": "Threat modeling",
      "domain": "security_risk",
      "applicability": "risk_based",
      "minimum_level": "L2",
      "maturity_path": [
        "L2",
        "L3"
      ],
      "governance_overlay": false,
      "routing_lane": "architecture",
      "assignment_basis": "risk_and_capability",
      "current_coverage": "partial",
      "existing_refs": [
        "S5",
        "P8"
      ],
      "rationale": "Maintained threat models require a managed design and review capability.",
      "review_status": "human_review_required"
    },
    {
      "requirement_id": "HREQ-RISK-003",
      "title": "Risk treatment and reassessment",
      "domain": "security_risk",
      "applicability": "risk_based",
      "minimum_level": "L2",
      "maturity_path": [
        "L2",
        "L3"
      ],
      "governance_overlay": false,
      "routing_lane": "architecture",
      "assignment_basis": "risk_and_capability",
      "current_coverage": "partial",
      "existing_refs": [
        "AG-EXC-001",
        "RG-RELEASE-READY"
      ],
      "rationale": "Risk treatment and reassessment require managed ownership, verification, and change triggers.",
      "review_status": "human_review_required"
    },
    {
      "requirement_id": "HREQ-RISK-004",
      "title": "Security architecture review",
      "domain": "security_risk",
      "applicability": "risk_based",
      "minimum_level": "L2",
      "maturity_path": [
        "L2",
        "L3"
      ],
      "governance_overlay": false,
      "routing_lane": "architecture",
      "assignment_basis": "risk_and_capability",
      "current_coverage": "partial",
      "existing_refs": [
        "S5",
        "P8",
        "E6"
      ],
      "rationale": "Formal security architecture review is a managed assurance capability enhanced at L3.",
      "review_status": "human_review_required"
    },
    {
      "requirement_id": "HREQ-APP-001",
      "title": "Authentication and authorization",
      "domain": "application_security",
      "applicability": "capability_based",
      "minimum_level": "L1",
      "maturity_path": [
        "L1",
        "L2",
        "L3"
      ],
      "governance_overlay": false,
      "routing_lane": "product_security",
      "assignment_basis": "risk_and_capability",
      "current_coverage": "partial",
      "existing_refs": [
        "S5",
        "P8"
      ],
      "rationale": "Authentication and authorization are foundational for software that exposes identities or protected functions.",
      "review_status": "human_review_required"
    },
    {
      "requirement_id": "HREQ-APP-002",
      "title": "Session security",
      "domain": "application_security",
      "applicability": "session_capable_software",
      "minimum_level": "L1",
      "maturity_path": [
        "L1",
        "L2",
        "L3"
      ],
      "governance_overlay": false,
      "routing_lane": "product_security",
      "assignment_basis": "risk_and_capability",
      "current_coverage": "gap",
      "existing_refs": [],
      "rationale": "Session protection is a foundational requirement whenever session capability exists.",
      "review_status": "human_review_required"
    },
    {
      "requirement_id": "HREQ-APP-003",
      "title": "Data and cryptographic protection",
      "domain": "application_security",
      "applicability": "sensitive_data_processing",
      "minimum_level": "L1",
      "maturity_path": [
        "L1",
        "L2",
        "L3"
      ],
      "governance_overlay": false,
      "routing_lane": "product_security",
      "assignment_basis": "risk_and_capability",
      "current_coverage": "partial",
      "existing_refs": [
        "S5",
        "P8",
        "E5"
      ],
      "rationale": "Sensitive-data protection begins at L1 and gains centrally managed cryptographic assurance at higher levels.",
      "review_status": "human_review_required"
    },
    {
      "requirement_id": "HREQ-APP-004",
      "title": "Input validation and business logic",
      "domain": "application_security",
      "applicability": "input_processing_software",
      "minimum_level": "L1",
      "maturity_path": [
        "L1",
        "L2",
        "L3"
      ],
      "governance_overlay": false,
      "routing_lane": "product_security",
      "assignment_basis": "risk_and_capability",
      "current_coverage": "gap",
      "existing_refs": [],
      "rationale": "Input, output, and business-rule validation are foundational for software that processes untrusted input.",
      "review_status": "human_review_required"
    },
    {
      "requirement_id": "HREQ-APP-005",
      "title": "Secure file handling",
      "domain": "application_security",
      "applicability": "file_processing_software",
      "minimum_level": "L1",
      "maturity_path": [
        "L1",
        "L2",
        "L3"
      ],
      "governance_overlay": false,
      "routing_lane": "product_security",
      "assignment_basis": "risk_and_capability",
      "current_coverage": "gap",
      "existing_refs": [],
      "rationale": "Safe file handling is foundational whenever file-processing capability exists.",
      "review_status": "human_review_required"
    },
    {
      "requirement_id": "HREQ-APP-006",
      "title": "Application logging and error handling",
      "domain": "application_security",